{
  "schema_version": "judge-verdict-v1",
  "validity": "valid",
  "severity": "critical",
  "confidence": 0.9,
  "rationale": "Traversal evidence fixture.",
  "evidence": [
    {
      "path": "../official-report.md",
      "start_line": 1,
      "end_line": 1,
      "content_digest": "sha256:dddddddddddddddddddddddddddddddddddddddddddddddddddddddddddddddd"
    }
  ],
  "verification_status": "unverified",
  "label_normalization_version": "severity-v1"
}
