{
  "schema_version": "judge-verdict-v1",
  "validity": "valid",
  "severity": "critical",
  "confidence": 1,
  "rationale": "The inclusive upper confidence boundary is valid for a source-grounded finding.",
  "evidence": [
    {
      "path": "contracts/Vault.sol",
      "start_line": 41,
      "end_line": 58,
      "content_digest": "sha256:eeeeeeeeeeeeeeeeeeeeeeeeeeeeeeeeeeeeeeeeeeeeeeeeeeeeeeeeeeeeeeee"
    }
  ],
  "verification_status": "unverified",
  "label_normalization_version": "severity-v1"
}
