{
  "schema_version": "judge-verdict-v1",
  "validity": "valid",
  "severity": "low",
  "confidence": 1.2,
  "rationale": "Confidence boundary fixture.",
  "evidence": [
    {
      "path": "contracts/Vault.sol",
      "start_line": 3,
      "end_line": 4,
      "content_digest": "sha256:eeeeeeeeeeeeeeeeeeeeeeeeeeeeeeeeeeeeeeeeeeeeeeeeeeeeeeeeeeeeeeee"
    }
  ],
  "verification_status": "unverified",
  "label_normalization_version": "severity-v1"
}
