{
  "schema_version": "judge-verdict-v1",
  "validity": "invalid",
  "severity": "none",
  "confidence": 0,
  "rationale": "The inclusive lower confidence boundary is valid for an invalid finding.",
  "evidence": [
    {
      "path": "contracts/Vault.sol",
      "start_line": 1,
      "end_line": 2,
      "content_digest": "sha256:dddddddddddddddddddddddddddddddddddddddddddddddddddddddddddddddd"
    }
  ],
  "verification_status": "unverified",
  "label_normalization_version": "severity-v1"
}
