{
  "schema_version": "judge-verdict-v1",
  "validity": "valid",
  "severity": "high",
  "confidence": 0.82,
  "rationale": "The authorization condition is checked after the state-changing external interaction.",
  "evidence": [
    {
      "path": "contracts/Vault.sol",
      "start_line": 41,
      "end_line": 58,
      "content_digest": "sha256:aaaaaaaaaaaaaaaaaaaaaaaaaaaaaaaaaaaaaaaaaaaaaaaaaaaaaaaaaaaaaaaa",
      "note": "State update follows the interaction."
    }
  ],
  "verification_status": "unverified",
  "label_normalization_version": "severity-v1"
}
